{
  "Paths": {
    "DocsRoot": "overview",
    "SpecsRoot": "specs",
    "ArchitectureDir": "specs/architecture",
    "WorkItemsSpecsDir": "specs/work-items",
    "GeneratedDir": "specs/generated",
    "SpecsTemplatesDir": "specs/templates",
    "SpecsSchemasDir": "specs/schemas",
    "WorkRoot": "specs/work-items",
    "ItemsDir": "specs/work-items/WB"
  },
  "Ids": {
    "Width": 4
  },
  "Git": {
    "BranchPattern": "work/{id}-{slug}",
    "CommitMessagePattern": "Promote {id}: {title}",
    "DefaultBaseBranch": "main",
    "RequireCleanWorkingTree": true
  },
  "Github": {
    "Provider": "octokit",
    "DefaultDraft": false,
    "Host": "github.com",
    "Owner": null,
    "Repository": null,
    "Sync": {
      "Mode": "generate",
      "ConflictDefault": "fail",
      "ScheduleEnabled": false
    }
  },
  "Validation": {
    "LinkExclude": [
      "node_modules",
      "src/Workbench/wwwroot/lib/incursa-ui-kit"
    ],
    "DocExclude": []
  },
  "Tui": {
    "Theme": "powershell",
    "UseEmoji": true,
    "AutoRefreshSeconds": 60
  }
}
